{
  "$schema": "https://json-schema.org/draft/2020-12/schema",
  "type": "object",
  "additionalProperties": false,
  "required": [
    "country",
    "business_establishment_country",
    "customer_type_claimed",
    "business_status",
    "business_status_evidence",
    "status_evidence_reviewed",
    "vat_id",
    "vat_id_verification",
    "verification_at",
    "evidence_country_signals"
  ],
  "properties": {
    "country": {
      "type": [
        "string",
        "null"
      ],
      "pattern": "^[A-Z]{2}$"
    },
    "business_establishment_country": {
      "type": [
        "string",
        "null"
      ],
      "pattern": "^[A-Z]{2}$"
    },
    "customer_type_claimed": {
      "enum": [
        "business",
        "consumer",
        "unknown"
      ]
    },
    "business_status": {
      "enum": [
        "verified_business",
        "verified_non_business",
        "unverified",
        "unknown"
      ]
    },
    "business_status_evidence": {
      "type": "array",
      "items": {
        "enum": [
          "synthetic_valid_vat_id",
          "company_register",
          "contractual_business_account",
          "consumer_declaration",
          "other"
        ]
      }
    },
    "status_evidence_reviewed": {
      "type": "boolean"
    },
    "vat_id": {
      "type": [
        "string",
        "null"
      ]
    },
    "vat_id_verification": {
      "enum": [
        "not_checked",
        "synthetic_valid",
        "synthetic_invalid",
        "valid",
        "invalid",
        "unavailable",
        "unknown"
      ]
    },
    "verification_at": {
      "type": [
        "string",
        "null"
      ],
      "format": "date-time"
    },
    "evidence_country_signals": {
      "type": "array",
      "items": {
        "type": "object",
        "required": [
          "kind",
          "country",
          "observed_at"
        ],
        "properties": {
          "kind": {
            "enum": [
              "billing",
              "ip",
              "payment",
              "customer_statement",
              "registry",
              "vat_id_country",
              "business_establishment",
              "other"
            ]
          },
          "country": {
            "type": "string",
            "pattern": "^[A-Z]{2}$"
          },
          "observed_at": {
            "type": "string",
            "format": "date-time"
          }
        },
        "additionalProperties": false
      }
    },
    "taxable_person_acting_as_such": {
      "type": [
        "boolean",
        "null"
      ]
    },
    "taxable_person_capacity_reviewed": {
      "type": "boolean"
    },
    "vat_id_evidence_status": {
      "enum": [
        "NOT_PROVIDED",
        "PROVIDED_UNVERIFIED",
        "SYNTHETIC_VERIFIED",
        "LIVE_VERIFIED",
        "INVALID",
        "VERIFICATION_UNAVAILABLE"
      ]
    }
  }
}
